<?xml version="1.0" encoding="UTF-8" ?>
<Persons xmlns:xsi="http://www.w3.org/2001/XMLSchema-instance"
            xsi:schemaLocation="http://by.it.meshchenko/Persons Persons.xsd"
            xmlns="http://by.it.meshchenko/Persons"
>
    <Person>
        <Email>asd@aasd.it</Email>
        <Nickname>qwerty</Nickname>
        <Password>123</Password>
        <Ads>
            <Ad>
                <Description>GOOD</Description>
                <Count>555</Count>
                <Square>50</Square>
            </Ad>
        </Ads>
    </Person>
</Persons>